{
  "name": "parallel_tool_ordering",
  "limits": {
    "max_parallel_tool_calls": 2
  },
  "model_steps": [
    {
      "parts": [],
      "tool_calls": [
        {
          "id": "call-slow",
          "name": "delayed_echo",
          "mode": "execute",
          "arguments": {
            "text": "slow",
            "delay": 0.03
          }
        },
        {
          "id": "call-fast",
          "name": "delayed_echo",
          "mode": "execute",
          "arguments": {
            "text": "fast",
            "delay": 0.01
          }
        }
      ]
    },
    {
      "parts": [
        {
          "type": "text",
          "text": "done"
        }
      ],
      "tool_calls": []
    }
  ],
  "expected_status": "completed",
  "expected_final_text": "done",
  "expected_tool_calls": 2,
  "expected_tool_texts": [
    "slow",
    "fast"
  ],
  "forbidden_checkpoint_tool_counts": [
    1
  ]
}
