{
  "name": "child_run_correlation",
  "runtime_context": {
    "run_id": "child-run-1",
    "started_at": 1.0,
    "deadline": null,
    "metadata": {},
    "parent_run_id": "parent-run-1",
    "parent_tool_call_id": "call-1",
    "run_kind": "subagent",
    "sequence": 0
  },
  "model_steps": [
    {
      "parts": [
        {
          "type": "text",
          "text": "child done"
        }
      ],
      "tool_calls": []
    }
  ],
  "expected_status": "completed",
  "expected_final_text": "child done",
  "expected_tool_calls": 0,
  "expected_child_run": {
    "parent_run_id": "parent-run-1",
    "parent_tool_call_id": "call-1",
    "run_kind": "subagent"
  },
  "expected_event_types": ["child_run_started", "child_run_completed"],
  "expected_trace_kinds": ["child_run_started", "child_run_completed"]
}
