{
  "name": "tool_external_wait_pause",
  "model_steps": [
    {
      "parts": [],
      "tool_calls": [
        {
          "id": "call-1",
          "name": "wait",
          "mode": "execute",
          "arguments": {
            "text": "external wait started",
            "wait_id": "job-1",
            "reason": "external_callback"
          }
        }
      ]
    }
  ],
  "expected_status": "paused",
  "expected_tool_calls": 1,
  "expected_message_roles": [
    "user",
    "assistant",
    "tool"
  ],
  "expected_tool_texts": [
    "external wait started"
  ],
  "expected_pause": {
    "reason": "external_callback",
    "resume_status": "planning",
    "source": "tool",
    "wait_id": "job-1",
    "metadata": {}
  },
  "forbidden_unpaused_checkpoint_tool_counts": [
    1
  ]
}
