{
  "name": "conversation_insert_during_model_call",
  "conversation_insert": {
    "id": "insert-1",
    "source": "external_test",
    "parts": [
      {
        "type": "text",
        "text": "external update"
      }
    ],
    "correlation_id": "job-1",
    "metadata": {}
  },
  "conversation_insert_timing": "during_model_call",
  "model_steps": [
    {
      "parts": [
        {
          "type": "text",
          "text": "stale"
        }
      ],
      "tool_calls": []
    },
    {
      "parts": [
        {
          "type": "text",
          "text": "saw external update"
        }
      ],
      "tool_calls": []
    }
  ],
  "expected_status": "completed",
  "expected_final_text": "saw external update",
  "expected_tool_calls": 0,
  "expected_message_roles": ["user", "external", "assistant"],
  "expected_event_types": ["conversation_inserted"],
  "expected_trace_kinds": ["conversation_insert"]
}
