{
  "name": "parallel_external_wait_first_wins",
  "limits": {
    "max_parallel_tool_calls": 2
  },
  "model_steps": [
    {
      "parts": [],
      "tool_calls": [
        {
          "id": "call-1",
          "name": "parallel_wait",
          "arguments": {
            "text": "job one started",
            "wait_id": "job-1",
            "reason": "external_callback",
            "delay": 0.02
          }
        },
        {
          "id": "call-2",
          "name": "parallel_wait",
          "arguments": {
            "text": "job two started",
            "wait_id": "job-2",
            "reason": "external_callback",
            "delay": 0
          }
        }
      ]
    }
  ],
  "expected_status": "paused",
  "expected_tool_calls": 2,
  "expected_message_roles": ["user", "assistant", "tool", "tool"],
  "expected_tool_texts": ["job one started", "job two started"],
  "expected_pause": {
    "reason": "external_callback",
    "resume_status": "planning",
    "source": "tool",
    "wait_id": "job-1",
    "metadata": {}
  },
  "forbidden_checkpoint_tool_counts": [1],
  "forbidden_unpaused_checkpoint_tool_counts": [2]
}
